{
  "$schema": "https://json-schema.org/draft/2020-12/schema",
  "$id": "https://repomesh.dev/schemas/node.schema.json",
  "title": "RepoMesh Node Manifest",
  "type": "object",
  "additionalProperties": false,
  "required": ["id", "kind", "provides", "consumes", "interfaces", "invariants", "maintainers"],
  "properties": {
    "id": {
      "type": "string",
      "pattern": "^[A-Za-z0-9_.-]+\\/[A-Za-z0-9_.-]+$",
      "description": "org/repo"
    },
    "kind": {
      "type": "string",
      "enum": ["registry", "attestor", "policy", "oracle", "compute", "settlement", "governance", "identity"]
    },
    "description": { "type": "string", "minLength": 1, "maxLength": 300 },
    "homepage": { "type": "string", "format": "uri" },
    "provides": {
      "type": "array",
      "minItems": 1,
      "items": { "$ref": "#/$defs/capability" },
      "uniqueItems": true
    },
    "consumes": {
      "type": "array",
      "items": { "$ref": "#/$defs/capability" },
      "uniqueItems": true,
      "default": []
    },
    "interfaces": {
      "type": "array",
      "minItems": 1,
      "items": { "$ref": "#/$defs/interface" }
    },
    "invariants": {
      "type": "object",
      "additionalProperties": false,
      "required": ["deterministicBuild", "signedReleases", "semver", "changelog"],
      "properties": {
        "deterministicBuild": { "type": "boolean" },
        "signedReleases": { "type": "boolean" },
        "semver": { "type": "boolean" },
        "changelog": { "type": "boolean" }
      }
    },
    "maintainers": {
      "type": "array",
      "minItems": 1,
      "items": { "$ref": "#/$defs/maintainer" }
    },
    "tags": {
      "type": "array",
      "items": { "type": "string", "minLength": 1, "maxLength": 40 },
      "uniqueItems": true,
      "default": []
    }
  },
  "$defs": {
    "capability": {
      "type": "string",
      "pattern": "^[a-z][a-z0-9-]*(\\.[a-z][a-z0-9-]*)*\\.v[0-9]+$",
      "description": "Namespaced capability ending with .vN (e.g., build.provenance.v1)"
    },
    "interface": {
      "type": "object",
      "additionalProperties": false,
      "required": ["name", "version", "schemaPath"],
      "properties": {
        "name": { "type": "string", "pattern": "^[A-Za-z0-9_.-]+$" },
        "version": { "type": "string", "pattern": "^v[0-9]+$" },
        "schemaPath": { "type": "string", "pattern": "^(\\./)?[A-Za-z0-9_./-]+\\.json$" },
        "stability": { "type": "string", "enum": ["experimental", "stable"], "default": "stable" }
      }
    },
    "maintainer": {
      "type": "object",
      "additionalProperties": false,
      "required": ["name", "keyId", "publicKey"],
      "properties": {
        "name": { "type": "string", "minLength": 1, "maxLength": 80 },
        "keyId": {
          "type": "string",
          "pattern": "^[a-z0-9][a-z0-9._-]{0,118}[a-z0-9]$",
          "description": "Stable key identifier for signature matching (e.g., mike-2026-01, ci-shipcheck)."
        },
        "publicKey": {
          "type": "string",
          "description": "Public key for signing events (ed25519). PEM format.",
          "minLength": 32,
          "maxLength": 600
        },
        "contact": { "type": "string", "maxLength": 120 },
        "validFrom": { "type": "string", "format": "date-time" },
        "validUntil": { "type": "string", "format": "date-time" },
        "revokedAt": { "type": "string", "format": "date-time" },
        "revocationReason": { "type": "string", "enum": ["rotation", "compromise", "retirement"] },
        "invalidAfter": {
          "type": "string",
          "format": "date-time",
          "description": "RFC 5280 §5.3.2 invalidity date. The trust boundary for a compromise (may precede revokedAt). Defaults to revokedAt when reason=compromise and this is absent."
        }
      }
    }
  }
}
