{
  "id": "mcp-tool-shop-org/repomesh-xrpl-anchor",
  "kind": "attestor",
  "description": "XRPL anchor node — posts Merkle roots of ledger partitions to XRP Ledger for public finality",
  "provides": ["ledger.anchor.v1"],
  "consumes": ["network.ledger.v1"],
  "interfaces": [{ "name": "xrpl-anchor", "version": "v1", "schemaPath": "./schemas/event.schema.json" }],
  "invariants": { "deterministicBuild": true, "signedReleases": true, "semver": true, "changelog": true },
  "maintainers": [
    {
      "name": "mcp-tool-shop",
      "keyId": "ci-repomesh-xrpl-anchor-2026",
      "publicKey": "-----BEGIN PUBLIC KEY-----\nMCowBQYDK2VwAyEAauffIokii3uu7oOQvkFXemEROPhBjnez/DEyir25J7w=\n-----END PUBLIC KEY-----",
      "contact": "64996768+mcp-tool-shop@users.noreply.github.com"
    }
  ],
  "tags": ["repomesh", "anchor", "xrpl", "finality"]
}
