{
  "id": "mcp-tool-shop-org/cognate",
  "kind": "governance",
  "description": "Cognate -- structural governance for autonomous intelligence. Proves what an AI system was permitted to do, what it did, and who authorized it.",
  "homepage": "https://mcp-tool-shop-org.github.io/cognate/",
  "provides": [
    "governance.policy.v1",
    "governance.identity.v1",
    "governance.model-registry.v1",
    "governance.prompt-store.v1",
    "governance.repomesh-bridge.v1"
  ],
  "consumes": [
    "network.registry.v1",
    "network.ledger.v1",
    "network.schema.v1"
  ],
  "interfaces": [
    {
      "name": "cognate-api",
      "version": "v1",
      "schemaPath": "./packages/node/src/server.ts",
      "stability": "stable"
    }
  ],
  "invariants": {
    "deterministicBuild": true,
    "signedReleases": true,
    "semver": true,
    "changelog": true
  },
  "maintainers": [
    {
      "name": "mcp-tool-shop",
      "keyId": "ci-cognate-2026",
      "publicKey": "-----BEGIN PUBLIC KEY-----\nMCowBQYDK2VwAyEAhQieXTLWH9lKcHRUrXYzP9hGps6x1kEq3SP69QOp56E=\n-----END PUBLIC KEY-----",
      "contact": "64996768+mcp-tool-shop@users.noreply.github.com"
    }
  ],
  "tags": [
    "cognate",
    "ai-governance",
    "attestation",
    "web3",
    "autonomous-systems"
  ]
}
