{
  "id": "mcp-tool-shop-org/repomesh-security-verifier",
  "kind": "attestor",
  "description": "RepoMesh verifier: dependency vulnerability scan via OSV.dev using SBOM PURLs.",
  "homepage": "https://github.com/mcp-tool-shop-org/repomesh",
  "provides": ["security.scan.v1"],
  "consumes": ["network.ledger.v1"],
  "interfaces": [
    { "name": "repomesh-attestation", "version": "v1", "schemaPath": "./schemas/event.schema.json", "stability": "experimental" }
  ],
  "invariants": { "deterministicBuild": true, "signedReleases": true, "semver": true, "changelog": true },
  "maintainers": [
    {
      "name": "mcp-tool-shop",
      "keyId": "ci-repomesh-security-verifier-2026",
      "publicKey": "-----BEGIN PUBLIC KEY-----\nMCowBQYDK2VwAyEAauffIokii3uu7oOQvkFXemEROPhBjnez/DEyir25J7w=\n-----END PUBLIC KEY-----",
      "contact": "64996768+mcp-tool-shop@users.noreply.github.com"
    }
  ],
  "tags": ["repomesh", "verifier", "security", "vulnerability"]
}
